{
  "coverages": [
    {
      "coverage_code": "WC 00 00 04",
      "coverage_type": "Workers' Compensation and Employers Liability",
      "deductible": null,
      "form_numbers": [
        "WC 00 00 04",
        "WC 00 04 22",
        "WC 38 03 01"
      ],
      "limit": "Workers' Compensation: Statutory; Employers Liability: Bodily Injury by Accident 1000000; Bodily Injury by Disease - Policy Limit 1000000; Bodily Injury by Disease - Each Employee 1000000",
      "premium": 1158173
    },
    {
      "coverage_code": "CG 00 01",
      "coverage_type": "Commercial General Liability",
      "deductible": 10000,
      "form_numbers": [
        "CG 00 01 04 13",
        "IL 00 21 09 08",
        "IL 00 17 11 98",
        "CG 24 26 04 13",
        "CG 21 47 12 07",
        "CG 20 10 04 13",
        "CG 20 37 04 13",
        "CG 20 33 04 13",
        "IL 09 85 01 15",
        "CG 21 49 09 99",
        "CG 21 44 09 15",
        "CG 25 03 05 09"
      ],
      "limit": "Each Occurrence 2000000; General Aggregate 4000000; Products-Completed Operations Aggregate 4000000; Personal & Advertising Injury 2000000; Damage to Rented Premises 300000; Medical Expense (Any One Person) 15000",
      "premium": 297028
    },
    {
      "coverage_code": "CA 00 01",
      "coverage_type": "Business Auto",
      "deductible": 2500,
      "form_numbers": [
        "CA 00 01 10 13",
        "IL 00 21 09 08",
        "IL 00 17 11 98",
        "IL 09 85 01 15",
        "CA 99 48 03 06",
        "CA 20 48 02 99"
      ],
      "limit": "Combined Single Limit 5000000; Uninsured/Underinsured Motorist 500000; Medical Payments 10000",
      "premium": 57890
    },
    {
      "coverage_code": "CP 00 10",
      "coverage_type": "Commercial Property",
      "deductible": 25000,
      "form_numbers": [
        "CP 00 10 10 12",
        "CP 00 30 10 12",
        "CP 10 30 10 12",
        "IL 00 21 09 08",
        "IL 00 17 11 98",
        "CP 01 40 07 06",
        "IL 09 85 01 15"
      ],
      "limit": "Building 10820000; Business Personal Property 18455000; Business Income with Extra Expense 10130000; Coinsurance 80%",
      "premium": 76074
    }
  ],
  "endorsements": [
    {
      "form_number": "WC 00 00 04",
      "title": "Workers Compensation and Employers Liability Insurance Policy"
    },
    {
      "form_number": "WC 00 04 22",
      "title": "Experience Rating Modification Factor Endorsement"
    },
    {
      "form_number": "WC 38 03 01",
      "title": "Pennsylvania Cancellation Conditions Endorsement"
    },
    {
      "form_number": "CG 00 01 04 13",
      "title": "Commercial General Liability Coverage Form"
    },
    {
      "form_number": "IL 00 21 09 08",
      "title": "Nuclear Energy Liability Exclusion"
    },
    {
      "form_number": "IL 00 17 11 98",
      "title": "Common Policy Conditions"
    },
    {
      "form_number": "CG 24 26 04 13",
      "title": "Amendment of Aggregate Limits of Insurance - Per Project"
    },
    {
      "form_number": "CG 21 47 12 07",
      "title": "Employment-Related Practices Exclusion"
    },
    {
      "form_number": "CG 20 10 04 13",
      "title": "Additional Insured \u2014 Owners, Lessees or Contractors"
    },
    {
      "form_number": "CG 20 37 04 13",
      "title": "Additional Insured \u2014 Owners, Lessees or Contractors (Completed Ops)"
    },
    {
      "form_number": "CG 20 33 04 13",
      "title": "Additional Insured - Owners, Lessees or Contractors - Automatic Status When Required in Construction Agreement"
    },
    {
      "form_number": "IL 09 85 01 15",
      "title": "Disclosure Pursuant to Terrorism Risk Insurance Act"
    },
    {
      "form_number": "CG 21 49 09 99",
      "title": "Total Pollution Exclusion With a Hostile Fire Exception"
    },
    {
      "form_number": "CG 21 44 09 15",
      "title": "Silica or Silica-Related Dust Exclusion"
    },
    {
      "form_number": "CG 25 03 05 09",
      "title": "Designated Construction Project(s) General Aggregate Limit"
    },
    {
      "form_number": "CA 00 01 10 13",
      "title": "Business Auto Coverage Form"
    },
    {
      "form_number": "CA 99 48 03 06",
      "title": "Pollution Liability \u2014 Broadened Coverage for Covered Autos"
    },
    {
      "form_number": "CA 20 48 02 99",
      "title": "Designated Insured"
    },
    {
      "form_number": "CP 00 10 10 12",
      "title": "Building and Personal Property Coverage Form"
    },
    {
      "form_number": "CP 00 30 10 12",
      "title": "Business Income (and Extra Expense) Coverage Form"
    },
    {
      "form_number": "CP 10 30 10 12",
      "title": "Causes of Loss \u2014 Special Form"
    },
    {
      "form_number": "CP 01 40 07 06",
      "title": "Ordinance or Law Coverage"
    }
  ],
  "forms_attached": [
    "WC 00 00 04",
    "WC 00 04 22",
    "WC 38 03 01",
    "CG 00 01 04 13",
    "IL 00 21 09 08",
    "IL 00 17 11 98",
    "CG 24 26 04 13",
    "CG 21 47 12 07",
    "CG 20 10 04 13",
    "CG 20 37 04 13",
    "CG 20 33 04 13",
    "IL 09 85 01 15",
    "CG 21 49 09 99",
    "CG 21 44 09 15",
    "CG 25 03 05 09",
    "CA 00 01 10 13",
    "CA 99 48 03 06",
    "CA 20 48 02 99",
    "CP 00 10 10 12",
    "CP 00 30 10 12",
    "CP 10 30 10 12",
    "CP 01 40 07 06"
  ],
  "insured": {
    "address": "300 Liberty Avenue, Suite 1200",
    "city": "Pittsburgh",
    "dba": null,
    "entity_type": "Corporation",
    "name": "Keystone Commercial Builders, Inc.",
    "state": "PA",
    "zip": "15222"
  },
  "locations": [],
  "policy_info": {
    "carrier_naic": "28339",
    "carrier_name": "Hallmark Insurance Group",
    "effective_date": "2025-08-01",
    "expiration_date": "2026-08-01",
    "policy_number": "WC-KCB-2025-5580; GL-KCB-2025-5581; CA-KCB-2025-5582; CP-KCB-2025-5583",
    "policy_type": "Commercial Package Policy"
  },
  "premium_summary": {
    "taxes_fees": null,
    "total_due": null,
    "total_premium": 1589165
  },
  "producer": {
    "address": null,
    "code": null,
    "name": null
  }
}