{
  "coverages": [
    {
      "coverage_code": "CP 00 10",
      "coverage_type": "Building",
      "deductible": 50000,
      "form_numbers": [
        "CP 00 10 10 12",
        "CP 10 30 10 12"
      ],
      "limit": "222340000",
      "premium": null
    },
    {
      "coverage_code": "CP 00 10",
      "coverage_type": "Business Personal Property",
      "deductible": 50000,
      "form_numbers": [
        "CP 00 10 10 12",
        "CP 10 30 10 12"
      ],
      "limit": "33432000",
      "premium": null
    },
    {
      "coverage_code": "CP 00 30",
      "coverage_type": "Business Income with Extra Expense",
      "deductible": 50000,
      "form_numbers": [
        "CP 00 30 10 12",
        "CP 10 30 10 12"
      ],
      "limit": "59212000",
      "premium": null
    },
    {
      "coverage_code": "CP 01 40",
      "coverage_type": "Ordinance or Law Coverage",
      "deductible": 50000,
      "form_numbers": [
        "CP 01 40 07 06"
      ],
      "limit": null,
      "premium": null
    },
    {
      "coverage_code": "CP 03 21",
      "coverage_type": "Windstorm or Hail Percentage Deductible",
      "deductible": null,
      "form_numbers": [
        "CP 03 21 06 07"
      ],
      "limit": null,
      "premium": null
    },
    {
      "coverage_code": null,
      "coverage_type": "Commercial Property",
      "deductible": 50000,
      "form_numbers": [
        "CP 00 10 10 12",
        "CP 00 30 10 12",
        "CP 10 30 10 12"
      ],
      "limit": "Building: 222340000; Business Personal Property: 33432000; Business Income with Extra Expense: 59212000; Coinsurance: 90%",
      "premium": 403697
    }
  ],
  "endorsements": [
    {
      "form_number": "IL 00 21 09 08",
      "title": "Nuclear Energy Liability Exclusion"
    },
    {
      "form_number": "IL 00 17 11 98",
      "title": "Common Policy Conditions"
    },
    {
      "form_number": "CP 01 40 07 06",
      "title": "Ordinance or Law Coverage"
    },
    {
      "form_number": "IL 09 85 01 15",
      "title": "Disclosure Pursuant to Terrorism Risk Insurance Act"
    },
    {
      "form_number": "CP 03 21 06 07",
      "title": "Windstorm or Hail Percentage Deductible"
    }
  ],
  "forms_attached": [
    "CP 00 10 10 12",
    "CP 00 30 10 12",
    "CP 10 30 10 12",
    "IL 00 21 09 08",
    "IL 00 17 11 98",
    "CP 01 40 07 06",
    "IL 09 85 01 15",
    "CP 03 21 06 07"
  ],
  "insured": {
    "address": "2200 Ross Avenue, Suite 4500",
    "city": "Dallas",
    "dba": null,
    "entity_type": "Limited Partnership",
    "name": "Lone Star Property Holdings, LP",
    "state": "TX",
    "zip": "75201"
  },
  "locations": [],
  "policy_info": {
    "carrier_naic": "68074",
    "carrier_name": "Apex Managing General Agency",
    "effective_date": "2025-07-01",
    "expiration_date": "2026-07-01",
    "policy_number": "CP-LSPH-2025-7801",
    "policy_type": "Commercial Property"
  },
  "premium_summary": {
    "taxes_fees": 18697,
    "total_due": 403697,
    "total_premium": 403697
  },
  "producer": {
    "address": null,
    "code": null,
    "name": null
  }
}