{
  "policy_info": {
    "policy_number": "WC GLFS 2025 8820 / gl GLFS 2025 8821 / cGLFS20258822 / cpGLFS20258823 / SIC CU025454 / SICMT032788",
    "policy_type": "Commercial Package",
    "effective_date": "2025-06-01",
    "expiration_date": "2026-06-01",
    "carrier_name": "Standard Insurance Company",
    "carrier_naic": "24281"
  },
  "insured": {
    "name": "Great Lakes Freight Systems, Incorporated",
    "dba": null,
    "address": "1200 Nationwide Blvd.",
    "city": "Columbus",
    "state": "OH",
    "zip": "43215",
    "entity_type": "Corporation"
  },
  "producer": {
    "name": null,
    "address": null,
    "code": null
  },
  "coverages": [
    {
      "coverage_type": "Workers' Compensation and Employers' Liability",
      "coverage_code": null,
      "limit": "Statutory",
      "deductible": null,
      "premium": 1170825,
      "form_numbers": [
        "BWC U-153"
      ]
    },
    {
      "coverage_type": "Commercial General Liability",
      "coverage_code": "CG 00 01",
      "limit": "2,000,000 Each Occurrence / 4,000,000 General Aggregate / 4,000,000 Products-Completed Ops / 2,000,000 Personal & Advertising Injury / 500,000 Damage to Rented Premises / 5,000 Medical Expense",
      "deductible": 5000,
      "premium": 153014,
      "form_numbers": [
        "CG 00 01 04 13",
        "IL 00 21 09 08",
        "IL 00 17 11 98",
        "CG 04 42",
        "CG 20 10 04 13",
        "CG 20 37 04 13",
        "IL 09 85 01 15",
        "CG 21 49 09 99"
      ]
    },
    {
      "coverage_type": "Stop Gap Employers' Liability",
      "coverage_code": "CG 04 42",
      "limit": "1,000,000 Each Accident / 1,000,000 Disease Policy / 1,000,000 Disease Each Employee",
      "deductible": null,
      "premium": null,
      "form_numbers": [
        "CG 04 42"
      ]
    },
    {
      "coverage_type": "Business Auto",
      "coverage_code": "CA 00 01",
      "limit": "5,000,000 Combined Single Limit / 500,000 Uninsured/Underinsured Motorist / 10,000 Medical Payments",
      "deductible": 5000,
      "premium": 262047,
      "form_numbers": [
        "IL 00 21 09 08",
        "IL 00 17 11 98",
        "CA 34 01 10 13",
        "MCS-90 (12 92)",
        "IL 09 85 01 15",
        "CA 99 48 03 06",
        "CA 20 48 02 99"
      ]
    },
    {
      "coverage_type": "Commercial Property",
      "coverage_code": "CP 00 10",
      "limit": "30,320,000 Building / 57,954,000 Business Personal Property / Business Income with Extra Expense 80% Coinsurance / Blanket 54,110,000",
      "deductible": 50000,
      "premium": 235711,
      "form_numbers": [
        "CP 00 10 10 12",
        "CP 00 30 10 12",
        "CP 10 30 10 12",
        "IL 00 21 09 08",
        "IL 00 17 11 98",
        "CP 12 18 06 07",
        "CP 01 40 07 06",
        "IL 09 85 01 15"
      ]
    },
    {
      "coverage_type": "Commercial Umbrella",
      "coverage_code": null,
      "limit": "10,000,000 Each Occurrence / 10,000,000 Aggregate / 50,000 Self-Insured Retention",
      "deductible": null,
      "premium": 492351,
      "form_numbers": [
        "Commercial Umbrella Liability Coverage Form",
        "Underlying Insurance Schedule",
        "Nuclear Energy Liability Exclusion",
        "Designated Underlying Insurance Endorsement",
        "Disclosure Pursuant to Terrorism Risk Insurance Act"
      ]
    },
    {
      "coverage_type": "Motor Truck Cargo (MTC)",
      "coverage_code": "CC 00 01",
      "limit": "100,000 Per Conveyance / 1,000,000 Per Loss",
      "deductible": 1000,
      "premium": 20000,
      "form_numbers": [
        "IL 00 17 11 98",
        "IL 00 21 09 08",
        "CC 70 02 04 13",
        "CC 70 06 04 13",
        "CC 00 01 12 11"
      ]
    }
  ],
  "locations": [
    {
      "location_number": "1",
      "address": "1200 Nationwide Blvd.",
      "city": "Columbus",
      "state": "OH",
      "zip": "43215",
      "description": null
    }
  ],
  "premium_summary": {
    "total_premium": 2333947,
    "taxes_fees": null,
    "total_due": 2333947
  },
  "endorsements": [
    {
      "form_number": "BWC U-153",
      "title": "Ohio Workers' Compensation Application"
    },
    {
      "form_number": "CG 00 01 04 13",
      "title": "Commercial General Liability Coverage Form"
    },
    {
      "form_number": "IL 00 21 09 08",
      "title": "Nuclear Energy Liability Exclusion"
    },
    {
      "form_number": "IL 00 17 11 98",
      "title": "Common Policy Conditions"
    },
    {
      "form_number": "CG 04 42",
      "title": "Stop Gap Employers' Liability Coverage Endorsement (OH)"
    },
    {
      "form_number": "CG 20 10 04 13",
      "title": "Additional Insured \u2014 Owners, Lessees or Contractors"
    },
    {
      "form_number": "CG 20 37 04 13",
      "title": "Additional Insured \u2014 Owners, Lessees or Contractors (Completed Ops)"
    },
    {
      "form_number": "IL 09 85 01 15",
      "title": "Disclosure Pursuant to Terrorism Risk Insurance Act"
    },
    {
      "form_number": "CG 21 49 09 99",
      "title": "Total Pollution Exclusion With a Hostile Fire Exception"
    },
    {
      "form_number": "CA 34 01 10 13",
      "title": "Motor Carrier Coverage Form"
    },
    {
      "form_number": "MCS-90 (12 92)",
      "title": "Endorsement for Motor Carrier Policies of Insurance for Public Liability"
    },
    {
      "form_number": "CA 99 48 03 06",
      "title": "Pollution Liability \u2014 Broadened Coverage for Covered Autos"
    },
    {
      "form_number": "CA 20 48 02 99",
      "title": "Designated Insured"
    },
    {
      "form_number": "CP 00 10 10 12",
      "title": "Building and Personal Property Coverage Form"
    },
    {
      "form_number": "CP 00 30 10 12",
      "title": "Business Income (and Extra Expense) Coverage Form"
    },
    {
      "form_number": "CP 10 30 10 12",
      "title": "Causes of Loss \u2014 Special Form"
    },
    {
      "form_number": "CP 12 18 06 07",
      "title": "Loss Payable Provisions"
    },
    {
      "form_number": "CP 01 40 07 06",
      "title": "Ordinance or Law Coverage"
    },
    {
      "form_number": "CC 70 02 04 13",
      "title": "Earned Freight Coverage Endorsement"
    },
    {
      "form_number": "CC 70 06 04 13",
      "title": "Refrigeration Breakdown Coverage Endorsement"
    },
    {
      "form_number": "CC 00 01 12 11",
      "title": "Motor Truck Cargo Coverage Form"
    }
  ],
  "forms_attached": [
    "BWC U-153",
    "CG 00 01 04 13",
    "IL 00 21 09 08",
    "IL 00 17 11 98",
    "CG 04 42",
    "CG 20 10 04 13",
    "CG 20 37 04 13",
    "IL 09 85 01 15",
    "CG 21 49 09 99",
    "CA 34 01 10 13",
    "MCS-90 (12 92)",
    "CA 99 48 03 06",
    "CA 20 48 02 99",
    "CP 00 10 10 12",
    "CP 00 30 10 12",
    "CP 10 30 10 12",
    "CP 12 18 06 07",
    "CP 01 40 07 06",
    "CC 70 02 04 13",
    "CC 70 06 04 13",
    "CC 00 01 12 11"
  ]
}