{
  "policy_info": {
    "policy_number": "WC-KCB-2025-5580 / GL-KCB-2025-5581 / CA-KCB-2025-5582 / CP-KCB-2025-5583",
    "policy_type": "Commercial Package",
    "effective_date": "2025-08-01",
    "expiration_date": "2026-08-01",
    "carrier_name": "Hallmark Insurance Group",
    "carrier_naic": "28339"
  },
  "insured": {
    "name": "Keystone Commercial Builders, Inc.",
    "dba": null,
    "address": "300 Liberty Avenue, Suite 1200",
    "city": "Pittsburgh",
    "state": "PA",
    "zip": "15222",
    "entity_type": "Corporation"
  },
  "producer": {
    "name": null,
    "address": null,
    "code": null
  },
  "coverages": [
    {
      "coverage_type": "Workers' Compensation - Part One",
      "coverage_code": "WC 00 00 04",
      "limit": "Statutory",
      "deductible": null,
      "premium": 1158173,
      "form_numbers": [
        "WC 00 00 04",
        "WC 00 04 22",
        "WC 38 03 01",
        "WC 00 02 01"
      ]
    },
    {
      "coverage_type": "Employers' Liability - Bodily Injury by Accident",
      "coverage_code": "WC 00 00 04",
      "limit": 1000000,
      "deductible": null,
      "premium": null,
      "form_numbers": [
        "WC 00 00 04"
      ]
    },
    {
      "coverage_type": "Employers' Liability - Bodily Injury by Disease Policy Limit",
      "coverage_code": "WC 00 00 04",
      "limit": 1000000,
      "deductible": null,
      "premium": null,
      "form_numbers": [
        "WC 00 00 04"
      ]
    },
    {
      "coverage_type": "Employers' Liability - Bodily Injury by Disease Each Employee",
      "coverage_code": "WC 00 00 04",
      "limit": 1000000,
      "deductible": null,
      "premium": null,
      "form_numbers": [
        "WC 00 00 04"
      ]
    },
    {
      "coverage_type": "Commercial General Liability - Each Occurrence",
      "coverage_code": "CG 00 01",
      "limit": 2000000,
      "deductible": 10000,
      "premium": 297028,
      "form_numbers": [
        "CG 00 01 04 13"
      ]
    },
    {
      "coverage_type": "Commercial General Liability - General Aggregate",
      "coverage_code": "CG 00 01",
      "limit": 4000000,
      "deductible": 10000,
      "premium": null,
      "form_numbers": [
        "CG 00 01 04 13"
      ]
    },
    {
      "coverage_type": "Commercial General Liability - Products/Completed Operations Aggregate",
      "coverage_code": "CG 00 01",
      "limit": 4000000,
      "deductible": 10000,
      "premium": null,
      "form_numbers": [
        "CG 00 01 04 13"
      ]
    },
    {
      "coverage_type": "Commercial General Liability - Personal & Advertising Injury",
      "coverage_code": "CG 00 01",
      "limit": 2000000,
      "deductible": 10000,
      "premium": null,
      "form_numbers": [
        "CG 00 01 04 13"
      ]
    },
    {
      "coverage_type": "Commercial General Liability - Damage to Rented Premises",
      "coverage_code": "CG 00 01",
      "limit": 300000,
      "deductible": 10000,
      "premium": null,
      "form_numbers": [
        "CG 00 01 04 13"
      ]
    },
    {
      "coverage_type": "Commercial General Liability - Medical Expense (Any One Person)",
      "coverage_code": "CG 00 01",
      "limit": 15000,
      "deductible": 10000,
      "premium": null,
      "form_numbers": [
        "CG 00 01 04 13"
      ]
    },
    {
      "coverage_type": "Business Auto - Combined Single Limit",
      "coverage_code": "CA 00 01",
      "limit": 5000000,
      "deductible": 2500,
      "premium": 57890,
      "form_numbers": [
        "CA 00 01 10 13"
      ]
    },
    {
      "coverage_type": "Business Auto - Uninsured/Underinsured Motorist",
      "coverage_code": "CA 00 01",
      "limit": 500000,
      "deductible": 2500,
      "premium": null,
      "form_numbers": [
        "CA 00 01 10 13"
      ]
    },
    {
      "coverage_type": "Business Auto - Medical Payments",
      "coverage_code": "CA 00 01",
      "limit": 10000,
      "deductible": 2500,
      "premium": null,
      "form_numbers": [
        "CA 00 01 10 13"
      ]
    },
    {
      "coverage_type": "Commercial Property - Building",
      "coverage_code": "CP 00 10",
      "limit": 10820000,
      "deductible": 25000,
      "premium": 76074,
      "form_numbers": [
        "CP 00 10 10 12"
      ]
    },
    {
      "coverage_type": "Commercial Property - Business Personal Property",
      "coverage_code": "CP 00 10",
      "limit": 18455000,
      "deductible": 25000,
      "premium": null,
      "form_numbers": [
        "CP 00 10 10 12"
      ]
    },
    {
      "coverage_type": "Commercial Property - Business Income with Extra Expense",
      "coverage_code": "CP 00 30",
      "limit": 10130000,
      "deductible": 25000,
      "premium": null,
      "form_numbers": [
        "CP 00 30 10 12"
      ]
    }
  ],
  "locations": [
    {
      "location_number": "1",
      "address": "300 Liberty Avenue, Suite 1200",
      "city": "Pittsburgh",
      "state": "PA",
      "zip": "15222",
      "description": null
    }
  ],
  "premium_summary": {
    "total_premium": 1589165,
    "taxes_fees": 17902,
    "total_due": 1589165
  },
  "endorsements": [
    {
      "form_number": "WC 00 00 04",
      "title": "Workers' Compensation and Employers' Liability Insurance Policy"
    },
    {
      "form_number": "WC 00 04 22",
      "title": "Experience Rating Modification Factor Endorsement"
    },
    {
      "form_number": "WC 38 03 01",
      "title": "Pennsylvania Cancellation Conditions Endorsement"
    },
    {
      "form_number": "WC 00 02 01",
      "title": "Voluntary Compensation and Employers Liability Coverage Endorsement"
    },
    {
      "form_number": "CG 00 01 04 13",
      "title": "Commercial General Liability Coverage Form"
    },
    {
      "form_number": "IL 00 21 09 08",
      "title": "Nuclear Energy Liability Exclusion"
    },
    {
      "form_number": "IL 00 17 11 98",
      "title": "Common Policy Conditions"
    },
    {
      "form_number": "CG 25 03 05 09",
      "title": "Designated Construction Project(s) General Aggregate Limit"
    },
    {
      "form_number": "CG 20 10 04 13",
      "title": "Additional Insured - Owners, Lessees or Contractors"
    },
    {
      "form_number": "IL 09 85 01 15",
      "title": "Disclosure Pursuant to Terrorism Risk Insurance Act"
    },
    {
      "form_number": "CG 21 49 09 99",
      "title": "Total Pollution Exclusion With a Hostile Fire Exception"
    },
    {
      "form_number": "CG 21 43 09 15",
      "title": "Silica or Silica-Related Dust Exclusion"
    },
    {
      "form_number": "CG 20 33 04 13",
      "title": "Additional Insured - Owners/Lessees/Contractors - Automatic Status When Required in Construction Agreement"
    },
    {
      "form_number": "CG 20 37 04 13",
      "title": "Additional Insured - Owners, Lessees or Contractors - Completed Operations"
    },
    {
      "form_number": "CA 00 01 10 13",
      "title": "Business Auto Coverage Form"
    },
    {
      "form_number": "CA 99 48 03 06",
      "title": "Pollution Liability - Broadened Coverage for Covered Autos"
    },
    {
      "form_number": "CA 20 48 02 99",
      "title": "Designated Insured"
    },
    {
      "form_number": "CP 00 10 10 12",
      "title": "Building and Personal Property Coverage Form"
    },
    {
      "form_number": "CP 00 30 10 12",
      "title": "Business Income (and Extra Expense) Coverage Form"
    },
    {
      "form_number": "CP 10 30 10 12",
      "title": "Causes of Loss - Special Form"
    },
    {
      "form_number": "CP 01 40 07 06",
      "title": "Ordinance or Law Coverage"
    }
  ],
  "forms_attached": [
    "WC 00 00 04",
    "WC 00 04 22",
    "WC 38 03 01",
    "WC 00 02 01",
    "CG 00 01 04 13",
    "IL 00 21 09 08",
    "IL 00 17 11 98",
    "CG 25 03 05 09",
    "CG 20 10 04 13",
    "IL 09 85 01 15",
    "CG 21 49 09 99",
    "CG 21 43 09 15",
    "CG 20 33 04 13",
    "CG 20 37 04 13",
    "CA 00 01 10 13",
    "CA 99 48 03 06",
    "CA 20 48 02 99",
    "CP 00 10 10 12",
    "CP 00 30 10 12",
    "CP 10 30 10 12",
    "CP 01 40 07 06"
  ]
}