{
  "coverages": [
    {
      "coverage_code": null,
      "coverage_type": "Workers' Compensation and Employers' Liability",
      "deductible": null,
      "form_numbers": [
        "BWC U-153",
        "WC 00 03 01A",
        "BWC C-5"
      ],
      "limit": "Statutory",
      "premium": 1170825
    },
    {
      "coverage_code": "CG 00 01",
      "coverage_type": "Commercial General Liability",
      "deductible": 5000,
      "form_numbers": [
        "CG 00 01 04 13",
        "IL 00 21 09 08",
        "IL 00 17 11 98",
        "CG 04 42",
        "CG 20 10 04 13",
        "CG 24 04 05 09",
        "CG 20 37 04 13",
        "CG 20 26 04 13",
        "IL 09 85 01 15",
        "CG 21 96 03 05"
      ],
      "limit": "Each Occurrence 2000000; General Aggregate 4000000; Products-Completed Operations Aggregate 4000000; Personal and Advertising Injury 2000000; Damage to Rented Premises 500000; Medical Expense Any One Person 5000; Stop Gap EL Each Accident 1000000; Stop Gap EL Disease Policy 1000000; Stop Gap EL Disease Each Employee 1000000",
      "premium": 153014
    },
    {
      "coverage_code": "CA 00 01",
      "coverage_type": "Business Auto",
      "deductible": 5000,
      "form_numbers": [
        "CA 00 01 10 13",
        "IL 00 21 09 08",
        "IL 00 17 11 98",
        "CA 34 01 10 13",
        "MCS-90 (12/08)",
        "CA 99 50 10 13",
        "CA 99 54 10 13",
        "CA 04 44 10 13",
        "IL 09 85 01 15",
        "CA 99 48 03 06",
        "CA 20 48 02 99"
      ],
      "limit": "Combined Single Limit 5000000; Uninsured/Underinsured Motorist 500000; Medical Payments 10000",
      "premium": 262047
    },
    {
      "coverage_code": "CP 00 10",
      "coverage_type": "Commercial Property",
      "deductible": 50000,
      "form_numbers": [
        "CP 00 10 10 12",
        "CP 00 30 10 12",
        "CP 10 30 10 12",
        "IL 00 21 09 08",
        "IL 00 17 11 98",
        "CP 01 40 07 06",
        "IL 09 85 01 15"
      ],
      "limit": "Building 54110000; Business Personal Property 30320000; Business Income with Extra Expense 57954000; Coinsurance 80%",
      "premium": 235711
    },
    {
      "coverage_code": "CU 00 01",
      "coverage_type": "Commercial Umbrella",
      "deductible": 10000,
      "form_numbers": [
        "CU 00 01 04 13",
        "CU 21 73 04 13",
        "CU 21 09 04 13",
        "CU 21 55 01 15",
        "CU 21 39 09 08",
        "CU 24 07 04 13",
        "IL 09 85 01 15"
      ],
      "limit": "Each Occurrence 10000000; Aggregate 10000000; Self-Insured Retention 10000",
      "premium": 408351
    },
    {
      "coverage_code": "CC 00 01",
      "coverage_type": "Motor Truck Cargo",
      "deductible": 1000,
      "form_numbers": [
        "IL 00 17 11 98",
        "IL 00 21 09 08",
        "CC 00 01 12 11",
        "CC 70 02 04 13",
        "CC 70 06 04 13"
      ],
      "limit": "Per Conveyance 100000; Per Loss 1000000",
      "premium": 20000
    }
  ],
  "endorsements": [
    {
      "form_number": "BWC U-153",
      "title": "Ohio Workers' Compensation Application"
    },
    {
      "form_number": "WC 00 03 01A",
      "title": "Alternate Employer Endorsement"
    },
    {
      "form_number": "BWC C-5",
      "title": "Ohio Employer Application for Coverage"
    },
    {
      "form_number": "CG 00 01 04 13",
      "title": "Commercial General Liability Coverage Form"
    },
    {
      "form_number": "IL 00 21 09 08",
      "title": "Nuclear Energy Liability Exclusion"
    },
    {
      "form_number": "IL 00 17 11 98",
      "title": "Common Policy Conditions"
    },
    {
      "form_number": "CG 04 42",
      "title": "Stop Gap Employers' Liability Coverage Endorsement (OH)"
    },
    {
      "form_number": "CG 20 10 04 13",
      "title": "Additional Insured \u2014 Owners, Lessees or Contractors"
    },
    {
      "form_number": "CG 24 04 05 09",
      "title": "Waiver of Transfer of Rights of Recovery Against Others to Us"
    },
    {
      "form_number": "CG 20 37 04 13",
      "title": "Additional Insured \u2014 Owners, Lessees or Contractors (Completed Ops)"
    },
    {
      "form_number": "CG 20 26 04 13",
      "title": "Additional Insured - Designated Person or Organization"
    },
    {
      "form_number": "IL 09 85 01 15",
      "title": "Disclosure Pursuant to Terrorism Risk Insurance Act"
    },
    {
      "form_number": "CG 21 96 03 05",
      "title": "Silica or Silica-Related Dust Exclusion With a Hostile Fire Exception"
    },
    {
      "form_number": "CA 00 01 10 13",
      "title": "Business Auto Coverage Form"
    },
    {
      "form_number": "CA 34 01 10 13",
      "title": "Motor Carrier Coverage Form"
    },
    {
      "form_number": "MCS-90 (12/08)",
      "title": "Endorsement for Motor Carrier Policies of Insurance for Public Liability"
    },
    {
      "form_number": "CA 99 50 10 13",
      "title": "Drive Other Car Coverage - Broadened Coverage for Named Individuals"
    },
    {
      "form_number": "CA 99 54 10 13",
      "title": "Hired Auto Physical Damage Coverage"
    },
    {
      "form_number": "CA 04 44 10 13",
      "title": "Waiver of Transfer of Rights of Recovery Against Others to Us"
    },
    {
      "form_number": "CA 99 48 03 06",
      "title": "Pollution Liability - Broadened Coverage for Covered Autos"
    },
    {
      "form_number": "CA 20 48 02 99",
      "title": "Designated Insured"
    },
    {
      "form_number": "CP 00 10 10 12",
      "title": "Building and Personal Property Coverage Form"
    },
    {
      "form_number": "CP 00 30 10 12",
      "title": "Business Income (and Extra Expense) Coverage Form"
    },
    {
      "form_number": "CP 10 30 10 12",
      "title": "Causes of Loss \u2014 Special Form"
    },
    {
      "form_number": "CP 01 40 07 06",
      "title": "Ordinance or Law Coverage"
    },
    {
      "form_number": "CU 00 01 04 13",
      "title": "Commercial Umbrella Liability Coverage Form"
    },
    {
      "form_number": "CU 21 73 04 13",
      "title": "Schedule of Underlying Insurance"
    },
    {
      "form_number": "CU 21 09 04 13",
      "title": "Nuclear Energy Liability Exclusion"
    },
    {
      "form_number": "CU 21 55 01 15",
      "title": "Designated Underlying Insurance Endorsement"
    },
    {
      "form_number": "CU 21 39 09 08",
      "title": "Exclusion of Specific Accidents, Products, Work or Locations"
    },
    {
      "form_number": "CU 24 07 04 13",
      "title": "Following Form Endorsement \u2014 GL, Auto, EL"
    },
    {
      "form_number": "CC 00 01 12 11",
      "title": "Motor Truck Cargo Coverage Form"
    },
    {
      "form_number": "CC 70 02 04 13",
      "title": "Earned Freight Coverage Endorsement"
    },
    {
      "form_number": "CC 70 06 04 13",
      "title": "Refrigeration Breakdown Exclusion Endorsement"
    }
  ],
  "forms_attached": [
    "BWC U-153",
    "WC 00 03 01A",
    "BWC C-5",
    "CG 00 01 04 13",
    "IL 00 21 09 08",
    "IL 00 17 11 98",
    "CG 04 42",
    "CG 20 10 04 13",
    "CG 24 04 05 09",
    "CG 20 37 04 13",
    "CG 20 26 04 13",
    "IL 09 85 01 15",
    "CG 21 96 03 05",
    "CA 00 01 10 13",
    "CA 34 01 10 13",
    "MCS-90 (12/08)",
    "CA 99 50 10 13",
    "CA 99 54 10 13",
    "CA 04 44 10 13",
    "CA 99 48 03 06",
    "CA 20 48 02 99",
    "CP 00 10 10 12",
    "CP 00 30 10 12",
    "CP 10 30 10 12",
    "CP 01 40 07 06",
    "CU 00 01 04 13",
    "CU 21 73 04 13",
    "CU 21 09 04 13",
    "CU 21 55 01 15",
    "CU 21 39 09 08",
    "CU 24 07 04 13",
    "CC 00 01 12 11",
    "CC 70 02 04 13",
    "CC 70 06 04 13"
  ],
  "insured": {
    "address": "1200 Nationwide Blvd.",
    "city": "Columbus",
    "dba": null,
    "entity_type": "Corporation",
    "name": "Great Lakes Freight Systems, Incorporated",
    "state": "OH",
    "zip": "43215"
  },
  "locations": [],
  "policy_info": {
    "carrier_naic": "24281",
    "carrier_name": "Standard Insurance Company",
    "effective_date": "2025-06-01",
    "expiration_date": "2026-06-01",
    "policy_number": null,
    "policy_type": "Commercial Package"
  },
  "premium_summary": {
    "taxes_fees": null,
    "total_due": null,
    "total_premium": 2249948
  },
  "producer": {
    "address": null,
    "code": null,
    "name": null
  }
}